{
  "$schema": "https://json-schema.org/draft/2020-12/schema",
  "$id": "https://example.com/git-activity-report.full.range.schema.json",
  "title": "Git Activity Report \u2014 Full Mode Range Manifest ",
  "type": "object",
  "required": [
    "label",
    "range",
    "repo",
    "include_merges",
    "include_patch",
    "mode",
    "count",
    "authors",
    "summary",
    "items"
  ],
  "properties": {
    "label": {
      "type": [
        "string",
        "null"
      ]
    },
    "range": {
      "type": "object",
      "required": [
        "since",
        "until"
      ],
      "properties": {
        "since": {
          "type": "string"
        },
        "until": {
          "type": "string"
        }
      },
      "additionalProperties": false
    },
    "repo": {
      "type": "string"
    },
    "include_merges": {
      "type": "boolean"
    },
    "include_patch": {
      "type": "boolean"
    },
    "mode": {
      "type": "string",
      "enum": [
        "full"
      ]
    },
    "count": {
      "type": "integer",
      "minimum": 0
    },
    "authors": {
      "type": "object",
      "additionalProperties": {
        "type": "integer",
        "minimum": 0
      }
    },
    "summary": {
      "type": "object",
      "required": [
        "additions",
        "deletions",
        "files_touched"
      ],
      "properties": {
        "additions": {
          "type": "integer",
          "minimum": 0
        },
        "deletions": {
          "type": "integer",
          "minimum": 0
        },
        "files_touched": {
          "type": "integer",
          "minimum": 0
        }
      },
      "additionalProperties": true
    },
    "items": {
      "type": "array",
      "items": {
        "type": "object",
        "required": [
          "sha",
          "file",
          "subject"
        ],
        "properties": {
          "sha": {
            "type": "string",
            "pattern": "^[0-9a-f]{40}$"
          },
          "file": {
            "type": "string"
          },
          "subject": {
            "type": "string"
          }
        },
        "additionalProperties": false
      }
    },
    "unmerged_activity": {
      "type": "object",
      "required": [
        "branches_scanned",
        "branches",
        "total_unmerged_commits"
      ],
      "properties": {
        "branches_scanned": {
          "type": "integer",
          "minimum": 0
        },
        "total_unmerged_commits": {
          "type": "integer",
          "minimum": 0
        },
        "branches": {
          "type": "array",
          "items": {
            "type": "object",
            "required": [
              "name",
              "merged_into_head",
              "ahead_of_head",
              "behind_head"
            ],
            "properties": {
              "name": {
                "type": "string"
              },
              "merged_into_head": {
                "type": [
                  "boolean",
                  "null"
                ]
              },
              "ahead_of_head": {
                "type": [
                  "integer",
                  "null"
                ]
              },
              "behind_head": {
                "type": [
                  "integer",
                  "null"
                ]
              },
              "items": {
                "type": "array",
                "items": {
                  "type": "object",
                  "required": [
                    "sha",
                    "file",
                    "subject"
                  ],
                  "properties": {
                    "sha": {
                      "type": "string",
                      "pattern": "^[0-9a-f]{40}$"
                    },
                    "file": {
                      "type": "string"
                    },
                    "subject": {
                      "type": "string"
                    }
                  },
                  "additionalProperties": false
                }
              }
            },
            "additionalProperties": false
          }
        }
      },
      "additionalProperties": false
    }
  },
  "additionalProperties": false
}