{
  "label": "2025-08",
  "range": {
    "since": "2025-08-01T00:00:00",
    "until": "2025-09-01T00:00:00"
  },
  "repo": "/abs/path/to/repo",
  "include_merges": false,
  "include_patch": false,
  "mode": "full",
  "count": 1,
  "authors": {
    "James Cox <james@example.com>": 1
  },
  "summary": {
    "additions": 12,
    "deletions": 2,
    "files_touched": 1
  },
  "items": [
    {
      "sha": "aaaaaaaaaaaaaaaaaaaaaaaaaaaaaaaaaaaaaaaa",
      "file": "2025-08/2025.08.12-14.03-aaaaaaaaaaaa.json",
      "subject": "Implement feature X"
    }
  ],
  "unmerged_activity": {
    "branches_scanned": 1,
    "total_unmerged_commits": 1,
    "branches": [
      {
        "name": "feature/alpha",
        "merged_into_head": false,
        "ahead_of_head": 1,
        "behind_head": 0,
        "items": [
          {
            "sha": "bbbbbbbbbbbbbbbbbbbbbbbbbbbbbbbbbbbbbbbb",
            "file": "2025-08/unmerged/feature__alpha/2025.08.13-09.12-bbbbbbbbbbbb.json",
            "subject": "Refactor: extract service object"
          }
        ]
      }
    ]
  }
}